{
  "$schema": "../../schemas/d3_component_lineage_no_bypass_contract.schema.json",
  "config_version": "1.0.0",
  "contract_id": "D3_COMPONENT_LINEAGE_NO_BYPASS_CONTRACT_V1",
  "task_id": "D3-T03",
  "contract_status": "accepted",
  "contract_scope": "contract_only_component_ref_lineage_and_no_bypass_validation",
  "canonical_ref_table": "d3.daily_market_observations",
  "value_layer_object": "d3.daily_market_observation_values",
  "canonical_ref_contract": "D3_DAILY_MARKET_OBSERVATIONS_CONTRACT_V1",
  "value_layer_contract": "D3_DAILY_MARKET_OBSERVATION_VALUES_CONTRACT_V1",
  "formal_ingestion_authorized": false,
  "duckdb_write_authorized": false,
  "ddl_authorized": false,
  "real_data_materialization_authorized": false,
  "data_version_release_authorized": false,
  "pcvt_indicator_calculation_authorized": false,
  "r0_state_generation_authorized": false,
  "synthetic_test_only": true,
  "component_refs": [
    "raw_price_ref",
    "adjusted_price_ref",
    "trading_constraint_ref",
    "market_price_quality_ref",
    "mechanical_gap_ref",
    "pcvt_input_readiness_ref",
    "membership_ref",
    "calendar_ref",
    "source_snapshot_ref",
    "run_ref"
  ],
  "primary_key": [
    "data_version",
    "universe_id",
    "security_id",
    "trading_date",
    "observation_revision"
  ],
  "lineage_inheritance_fields": [
    "data_version",
    "universe_id",
    "time_segment_id",
    "security_id",
    "trading_date",
    "observation_revision",
    "canonical_observation_ref",
    "observed_at",
    "observed_at_rule",
    "revision_policy",
    "history_revision_class",
    "research_use_tier",
    "source_registry_id",
    "source_snapshot_id",
    "run_id",
    "source_snapshot_ref",
    "run_ref"
  ],
  "observed_at_revision_policy": {
    "observed_at_required": true,
    "observed_at_rule_required": true,
    "revision_policy_required": true,
    "history_revision_class_required": true,
    "research_use_tier_required": true,
    "final_revised_history_cannot_claim_point_in_time_support": true,
    "unknown_observed_at_blocks_formal_use": true,
    "missing_factor_as_of_time_blocks_formal_continuous_price_use": true,
    "unverified_revision_semantics_blocks_formal_use": true
  },
  "no_bypass_policy": {
    "future_policy_only_r0_currently_blocked": true,
    "allowed_r0_sources": [
      "d3.daily_market_observations",
      "d3.daily_market_observation_values"
    ],
    "prohibited_r0_sources": [
      "d1.raw_market_prices",
      "d1.corporate_actions",
      "d1.trading_constraints",
      "d2.adjusted_market_prices",
      "d2.market_price_quality_flags",
      "d2.membership_alignment",
      "D1/D2 raw component tables directly",
      "vendor payloads",
      "raw/qfq/hfq row payloads"
    ],
    "d1_d2_direct_read_prohibited": true
  },
  "validator_behavior": {
    "accept_synthetic_payload_only": true,
    "real_data_read_authorized": false,
    "duckdb_connection_authorized": false,
    "external_api_call_authorized": false,
    "manifest_creation_authorized": false
  },
  "prohibited_fields": [
    "raw_rows",
    "qfq_rows",
    "hfq_rows",
    "vendor_payload",
    "raw_vendor_payload",
    "future_return",
    "future_max_return",
    "label",
    "breakout_direction",
    "outcome",
    "target",
    "holding_period_return",
    "backtest_signal",
    "portfolio_return",
    "position",
    "trade",
    "order",
    "execution_price",
    "pcvt_value",
    "pcvt_score",
    "pcvt_state",
    "state",
    "q_threshold",
    "state_machine_version"
  ],
  "depends_on": [
    "D3_DAILY_MARKET_OBSERVATIONS_CONTRACT_V1",
    "D3_DAILY_MARKET_OBSERVATION_VALUES_CONTRACT_V1",
    "D2_ACCEPTANCE_D3_HANDOFF_CONTRACT_V1",
    "D2_MARKET_QUALITY_PCVT_DEPENDENCY_CONTRACT_V1",
    "D0_DATA_PRODUCT_CONTRACTS_V1"
  ]
}
